questions,option1,option2,option3,option4,answer
Which of the following can read and render HTML web pages,Server,Head tak,Web browser,Empty,Web browser
Among the following operators identify the one which is used to allocate memory to array variables in JavaScript.,new,new malloc,alloc,malloc,new
The latest HTML standard is,HTML 4.0,HTML 5.0,XML,SGML,HTML 5.0
Why were cookies designed?,for server-side programming,for client-side programming,both 1 and 2,none,for server-side programming
What are variables used in JavaScript programs,varying randomly,"storing numbers, dates and other variables",used as header files,none of the above,"storing numbers, dates and other variables"
Simple network management protocol uses which of the following port number,164,163,160,161,161
